{
  "content_types": {
    "agents": {
      "capabilities": {
        "agent_scopes": {
          "capabilities": {
            "project": {
              "confidence": "inferred",
              "mechanism": "project-scoped custom modes via .roomodes file in repo root (mode source field = 'project')",
              "supported": true
            },
            "user": {
              "confidence": "inferred",
              "mechanism": "user-scoped (global) custom modes via roo-code config (mode source field = 'global')",
              "supported": true
            }
          },
          "key": {
            "description": "Where agent definitions can live and the priority ordering when definitions exist at multiple levels. Common scopes: project, user/personal, managed/enterprise, CLI-defined.\n",
            "spec_ref": "ACIF-AGENT §9.2 (OUT-OF-SCOPE-AT-L1; install_scope_capabilities, ACIF-REGISTRY)",
            "type": "object"
          },
          "key_path": "agents.agent_scopes",
          "supported": true
        },
        "definition_format": {
          "confidence": "inferred",
          "key": {
            "description": "What format agent definitions use. Varies widely: Markdown with YAML frontmatter, JSON config files, TOML sections, or AGENTS.md plain markdown.\n",
            "spec_ref": "ACIF-AGENT §9.2 (OUT-OF-SCOPE-AT-L1)",
            "type": "string"
          },
          "key_path": "agents.definition_format",
          "mechanism": "YAML modes (.roomodes file or settings) with slug, name, description, roleDefinition, whenToUse, groups, source fields per ModeConfig + CustomModesSettings TypeScript types",
          "supported": true
        },
        "tool_restrictions": {
          "confidence": "inferred",
          "key": {
            "description": "Whether agents can be restricted to specific tools via allowlists, denylists, tool categories, or per-tool configuration maps.\n",
            "spec_ref": "ACIF-AGENT §9.1 (DERIVABLE); tool vocabulary ACIF-CORE Appendix A",
            "type": "bool"
          },
          "key_path": "agents.tool_restrictions",
          "mechanism": "per-mode tool group allowlist (read | edit | command | mcp) with optional inline filter (e.g. {fileRegex, description}) for the edit group, per GroupEntry / GroupOptions TypeScript types",
          "supported": true
        }
      },
      "supported": true
    },
    "skills": {
      "capabilities": {
        "canonical_filename": {
          "confidence": "confirmed",
          "key": {
            "description": "The required or conventional filename for this skill type. For example, \"SKILL.md\" for Claude Code skills.\n",
            "spec_ref": "ACIF-SKILL §10.2 (OUT-OF-SCOPE-AT-L1; discovery ACIF-SKILL §9)",
            "type": "string"
          },
          "key_path": "skills.canonical_filename",
          "mechanism": "SKILL.md",
          "supported": true
        },
        "compatibility": {
          "confidence": "confirmed",
          "key": {
            "description": "Provider compatibility constraints — which AI tool versions or providers this skill is compatible with.\n",
            "spec_ref": "ACIF-SKILL §10.2 (OUT-OF-SCOPE-AT-L1)",
            "type": "object"
          },
          "key_path": "skills.compatibility",
          "mechanism": "yaml frontmatter key: compatibility",
          "supported": true
        },
        "description": {
          "confidence": "confirmed",
          "key": {
            "description": "What the skill does. Used by the AI to decide when to auto-invoke it. Also shown in skill listings and help text.\n",
            "spec_ref": "ACIF-SKILL §10.2 (OUT-OF-SCOPE-AT-L1)",
            "type": "string"
          },
          "key_path": "skills.description",
          "mechanism": "yaml frontmatter key: description",
          "supported": true
        },
        "display_name": {
          "confidence": "confirmed",
          "key": {
            "description": "Human-readable display name for the skill. If omitted, the directory name is used. Shown in skill listings and menus.\n",
            "spec_ref": "ACIF-SKILL §10.2 (OUT-OF-SCOPE-AT-L1)",
            "type": "string"
          },
          "key_path": "skills.display_name",
          "mechanism": "yaml frontmatter key: name",
          "supported": true
        },
        "global_scope": {
          "confidence": "confirmed",
          "key": {
            "description": "Whether the skill can be installed at global/personal scope (applies across all projects for the current user).\n",
            "spec_ref": "ACIF-SKILL §10.2 (OUT-OF-SCOPE-AT-L1; install_scope_capabilities, ACIF-REGISTRY)",
            "type": "bool"
          },
          "key_path": "skills.global_scope",
          "mechanism": "user-global ~/.roo/skills/ directory",
          "supported": true
        },
        "license": {
          "confidence": "confirmed",
          "key": {
            "description": "SPDX license identifier for the skill content. Typically \"MIT\", \"Apache-2.0\", etc.\n",
            "spec_ref": "ACIF-SKILL §10.2 (OUT-OF-SCOPE-AT-L1)",
            "type": "string"
          },
          "key_path": "skills.license",
          "mechanism": "yaml frontmatter key: license",
          "supported": true
        },
        "metadata_map": {
          "confidence": "confirmed",
          "key": {
            "description": "Arbitrary key-value metadata attached to the skill. Provider-specific semantics; often used for tooling or automation metadata.\n",
            "spec_ref": "ACIF-SKILL §10.2 (OUT-OF-SCOPE-AT-L1)",
            "type": "object"
          },
          "key_path": "skills.metadata_map",
          "mechanism": "yaml frontmatter key: metadata",
          "supported": true
        },
        "project_scope": {
          "confidence": "confirmed",
          "key": {
            "description": "Whether the skill can be installed at project scope (applies to current project only, typically committed to version control).\n",
            "spec_ref": "ACIF-SKILL §10.2 (OUT-OF-SCOPE-AT-L1; install_scope_capabilities, ACIF-REGISTRY)",
            "type": "bool"
          },
          "key_path": "skills.project_scope",
          "mechanism": "per-project .roo/skills/ directory",
          "supported": true
        }
      },
      "supported": true
    }
  },
  "display_name": "Roo Code",
  "provider_exclusive": {
    "skills.frontmatter_compatibility": {
      "mechanism": "yaml key: compatibility",
      "supported": true
    },
    "skills.frontmatter_description": {
      "mechanism": "yaml key: description",
      "supported": true
    },
    "skills.frontmatter_license": {
      "mechanism": "yaml key: license",
      "supported": true
    },
    "skills.frontmatter_metadata": {
      "mechanism": "yaml key: metadata",
      "supported": true
    },
    "skills.frontmatter_name": {
      "mechanism": "yaml key: name",
      "supported": true
    }
  },
  "provider_status": "archived",
  "schema_version": "3",
  "slug": "roo-code",
  "status": "live"
}
