{
  "content_types": {
    "hooks": {
      "capabilities": {
        "matcher_patterns": {
          "confidence": "inferred",
          "key": {
            "description": "Whether hooks can filter which tools or events they respond to using name matching, regex patterns, or structured criteria.\n",
            "spec_ref": "ACIF-HOOK §10.1 (DERIVABLE)",
            "type": "bool"
          },
          "key_path": "hooks.matcher_patterns",
          "mechanism": "per-tool input matching documented under 'Match Conditions' / 'Regular Expression Patterns' headings (hook_match_input_contains)",
          "supported": true
        },
        "permission_control": {
          "confidence": "inferred",
          "key": {
            "description": "Whether hooks can make or influence permission decisions determining whether a tool is available for invocation. Minimum qualification: supported when the provider allows hooks to return permission decisions of any kind (grant, deny, or ask). Boundary: permission_control governs whether a tool is available; see decision_control for invocation-flow control.\n",
            "spec_ref": "ACIF-HOOK §10.2 (OUT-OF-SCOPE-AT-L1; script-body-opaque)",
            "type": "bool"
          },
          "key_path": "hooks.permission_control",
          "mechanism": "hooks integrate with amp's permission system to control tool availability (documented under 'How Permissions Work' / 'Add Rules' headings)",
          "supported": true
        }
      },
      "supported": true
    },
    "mcp": {
      "capabilities": {
        "enterprise_management": {
          "confidence": "inferred",
          "key": {
            "description": "Whether the provider supports organization-level MCP configuration management, including managed server lists, allowlists, and enterprise registries.\n",
            "spec_ref": "ACIF-MCP §9.2 (OUT-OF-SCOPE-AT-L1)",
            "type": "bool"
          },
          "key_path": "mcp.enterprise_management",
          "mechanism": "workspace-admin-enforced MCP registry with allowlist documented under 'MCP Registry Allowlist' heading (modelcontextprotocol.io schema; unreachable registry blocks all servers)",
          "supported": true
        },
        "oauth_support": {
          "confidence": "inferred",
          "key": {
            "description": "Whether the provider supports OAuth 2.0 authentication for remote MCP servers, including token storage and automatic refresh.\n",
            "spec_ref": "ACIF-MCP §9.1 (DERIVABLE)",
            "type": "bool"
          },
          "key_path": "mcp.oauth_support",
          "mechanism": "OAuth 2.0 authentication for remote MCP servers documented under 'OAuth for Remote MCP Servers' heading",
          "supported": true
        },
        "tool_filtering": {
          "confidence": "inferred",
          "key": {
            "description": "Which per-server tool filtering mechanisms the provider supports. Contents: {allowlist: bool, blocklist: bool, disable_flag: bool}. Controls which server tools are exposed to the agent. Boundary: tool_filtering governs tool visibility (what appears in the agent's available tool set); see auto_approve for execution gating of visible tools.\n",
            "spec_ref": "ACIF-MCP §9.1 (DERIVABLE)",
            "type": "object"
          },
          "key_path": "mcp.tool_filtering",
          "mechanism": "per-tool enable/disable documented under '3. Configure Tool Access' heading (VS Code UI exposes individual tool toggles within each configured server)",
          "supported": true
        }
      },
      "supported": true
    },
    "rules": {
      "capabilities": {
        "activation_mode": {
          "capabilities": {
            "always": {
              "confidence": "inferred",
              "mechanism": "AGENTS.md files are always_on within their scope (cwd, parent dirs, subtrees) — documented under 'AGENTS.md' / 'Writing AGENTS.md Files'",
              "supported": true
            },
            "glob": {
              "confidence": "inferred",
              "mechanism": "@-mentioned files use 'globs' frontmatter for selective activation (documented under 'Granular Guidance'); globs implicitly prefixed with **/ unless ../ or ./",
              "supported": true
            }
          },
          "key": {
            "description": "How rules decide when to load into context. Providers implement varying modes: always-on, conditional/glob-based, model-decision, and manual activation. Tracks which modes the provider supports and how they are configured.\n",
            "spec_ref": "ACIF-RULE §9.1 (DERIVABLE); activation-mode vocabulary ACIF-RULE Appendix A, §10",
            "type": "object"
          },
          "key_path": "rules.activation_mode",
          "supported": true
        },
        "cross_provider_recognition": {
          "capabilities": {
            "agents_md": {
              "confidence": "inferred",
              "mechanism": "native AGENTS.md format; 'Migrating to AGENTS.md' documents one-time mv+symlink from CLAUDE.md and .cursorrules",
              "supported": true
            }
          },
          "key": {
            "description": "Which rule file formats from other providers this provider recognizes. Contents: recognized_formats (list of filenames like AGENTS.md, .cursorrules, .windsurfrules). Minimum qualification: supported when the provider reads at least one rule-file format defined by a different provider.\n",
            "spec_ref": "ACIF-RULE §9.2 (OUT-OF-SCOPE-AT-L1; provider_capability_coverage, ACIF-REGISTRY §8.4)",
            "type": "object"
          },
          "key_path": "rules.cross_provider_recognition",
          "supported": true
        },
        "file_imports": {
          "confidence": "inferred",
          "key": {
            "description": "Whether rules can reference or include content from other files. Mechanisms vary: @-import syntax, @file.md directives, @path/to/file references.\n",
            "spec_ref": "ACIF-RULE §9.2 (OUT-OF-SCOPE-AT-L1; strongest requires candidate — see ACIF ROADMAP, body-content reference grammar)",
            "type": "bool"
          },
          "key_path": "rules.file_imports",
          "mechanism": "@-mention syntax includes other files as context — supports relative, absolute, and ~/ paths (documented under 'Granular Guidance')",
          "supported": true
        },
        "hierarchical_loading": {
          "confidence": "inferred",
          "key": {
            "description": "Whether rules load from multiple directory levels with defined precedence. Enables project-root rules plus subdirectory-scoped overrides.\n",
            "spec_ref": "ACIF-RULE §9.2 (OUT-OF-SCOPE-AT-L1; provider_capability_coverage, ACIF-REGISTRY §8.4)",
            "type": "bool"
          },
          "key_path": "rules.hierarchical_loading",
          "mechanism": "three-tier scope: AGENTS.md in cwd + parent dirs + subtrees + personal global at $HOME/.config/amp/AGENTS.md (documented under 'Writing AGENTS.md Files'); subtree loading is unique to amp",
          "supported": true
        }
      },
      "supported": true
    },
    "skills": {
      "capabilities": {
        "canonical_filename": {
          "confidence": "confirmed",
          "key": {
            "description": "The required or conventional filename for this skill type. For example, \"SKILL.md\" for Claude Code skills.\n",
            "spec_ref": "ACIF-SKILL §10.2 (OUT-OF-SCOPE-AT-L1; discovery ACIF-SKILL §9)",
            "type": "string"
          },
          "key_path": "skills.canonical_filename",
          "mechanism": "SKILL.md",
          "supported": true
        },
        "global_scope": {
          "confidence": "confirmed",
          "key": {
            "description": "Whether the skill can be installed at global/personal scope (applies across all projects for the current user).\n",
            "spec_ref": "ACIF-SKILL §10.2 (OUT-OF-SCOPE-AT-L1; install_scope_capabilities, ACIF-REGISTRY)",
            "type": "bool"
          },
          "key_path": "skills.global_scope",
          "mechanism": "skill directory placed under ~/.config/agents/skills/<name>/, ~/.config/amp/skills/<name>/, or ~/.claude/skills/<name>/",
          "supported": true
        },
        "project_scope": {
          "confidence": "confirmed",
          "key": {
            "description": "Whether the skill can be installed at project scope (applies to current project only, typically committed to version control).\n",
            "spec_ref": "ACIF-SKILL §10.2 (OUT-OF-SCOPE-AT-L1; install_scope_capabilities, ACIF-REGISTRY)",
            "type": "bool"
          },
          "key_path": "skills.project_scope",
          "mechanism": "skill directory placed under .agents/skills/<name>/ or .claude/skills/<name>/ within the project root",
          "supported": true
        }
      },
      "supported": true
    }
  },
  "display_name": "amp",
  "provider_exclusive": {
    "skills.creation_workflow": {
      "confidence": "inferred",
      "mechanism": "documented under 'Creating Skills' heading",
      "supported": true
    },
    "skills.executable_tools": {
      "confidence": "inferred",
      "mechanism": "documented under 'Executable Tools in Skills' heading",
      "supported": true
    },
    "skills.installation_workflow": {
      "confidence": "inferred",
      "mechanism": "documented under 'Installing Skills' heading",
      "supported": true
    },
    "skills.mcp_integration": {
      "confidence": "inferred",
      "mechanism": "documented under 'MCP Servers in Skills' heading",
      "supported": true
    }
  },
  "schema_version": "1",
  "slug": "amp",
  "status": "live"
}
